title,"${setText(w1, 'Купить')}  ${setText(w2, 'детский')}  ${setText(w3, 'фотоальбом')} ${setText(w4, ' на выпускной')} ${setText(w9s, ' в Москве ')} .${setText(w3s, 'Фотоальбомы')}  ${setText(w6, 'для фото ')}  ${setText(w5, 'онлайн ')} . Цены. Печать.${setText(w7, 'Оформление ')} . ${setText(w10, 'Обложки ')} .",,,,,,,,,,,,,,
собрать,0,выпускной,0,фотоальбом_фотоальбомы/альбом_альбомы,для выпускника 11 класса,0,создание онлайн,0,для разных фото,0,оформление своими руками на выпускной,0,0,Z/Москва / спб,бесплатная программа для создания выпускных тем
составить,0,семейный,0,фотоальбом_фотоальбомы/альбом_альбомы,для семейных фото,0,бесплатно,0,своими руками,0,мастер-класс по оформлению семейных фотографий,0,0,Z/Москва / спб,"цитаты, семейные фразы, стихи"
заказать,0,домашний,0,фотоальбом_фотоальбомы/альбом_альбомы,крещение,0,в интернете,0,с кармашками,0,оформление страниц для домашних тем,0,0,Z/Москва / спб,"конструктор, онлайн редактор для домашнего дизайна"
сделать,0,домашний,0,фотоальбом_фотоальбомы/альбом_альбомы,для старых фото,0,в подарок,0,в стиле винтаж,0,идеи оформления для дома,0,0,Z/Москва / спб,"форзацы, рамки, стикеры для старых фотографий"
сделать,0,розовый,0,фотоальбом_фотоальбомы/альбом_альбомы,для новорожденной девочки,0,самому,0,с картонными страницами,0,розовый дизайн,0,0,Z/Москва / спб,"розовые страницы для девочки, нежные обложки и стикеры"
создать и напечатать,0,детский,0,фотоальбом_фотоальбомы/альбом_альбомы,для новорожденного мальчика,0,на сайте,0,на 500 фотографий 10х15,0,темы оформления для детей,0,0,Z/Москва / спб,"подложки под фото, рамочки, стикеры для мальчиков"
заказать,0,школьный,0,фотоальбом_фотоальбомы/альбом_альбомы,школьника,0,в интернет-магазине,0,на 30 листов,0,изготовление на заказ,0,0,Z/Москва / спб,"переплет на пружине, на скрепке, книжный переплет"
заказать,0,черный,0,фотоальбом_фотоальбомы/альбом_альбомы,на 10 фото,0,почтой,0,на 50 листов,0,темы с черным дизайном и фоном,0,0,Z/Москва / спб,"первая страница, обложки, черные фоны"
оформить,0,книжный,0,фотоальбом_фотоальбомы/альбом_альбомы,на 20 фото,0,бесплатно,0,для фото,0,книжные темы оформления,0,0,Z/Москва / спб,книжный переплет в виде блокнота
создать,0,свадебный,0,фотоальбом_фотоальбомы/альбом_альбомы,на 36 фото,0,своими руками пошагово с фото,0,в стиле классика,0,свадебный дизайн для печати,0,0,Z/Москва / спб,"свадебный декор, рамки, фоны"
заказать,0,классический,0,фотоальбом_фотоальбомы/альбом_альбомы,семейных фотографий,0,недорого в интернете,0,в ретро стиле,0,классическое оформление фотографий,0,0,Z/Москва / спб,"фоторамки, классические украшения и фоны"
оформить,0,простой,0,фотоальбом_фотоальбомы/альбом_альбомы,скрапбукинг своими руками пошагово,0,бесплатно,0,для начинающих,0,простые идеи для дизайна,0,0,Z/Москва / спб,"украшения, стикеры, текст"
оформить онлайн,0,школьный,0,фотоальбом_фотоальбомы/альбом_альбомы,ученика,0,с фото своими руками,0,5 фото,0,школьный дизайн,0,0,Z/Москва / спб,стоимость
украсить,0,новорожденный,0,фотоальбом_фотоальбомы/альбом_альбомы,своими руками для мальчика,0,для начинающих,0,для детских фото,0,темы для новорожденных малышей,0,0,Z/Москва / спб,"детские стикеры, фоторамки, подложки"
купить,0,летний,0,фотоальбом_фотоальбомы/альбом_альбомы,на выпускной цена,0,в интернете,0,для наклеивания,0,летние темы отпуска,0,0,Z/Москва / спб,"тексты, заголовки, подписи к фото с летнего отдыха"
купить,0,классический,0,фотоальбом_фотоальбомы/альбом_альбомы,для больших фото,0,на официальном сайте,0,в переплете,0,классическое изготовление,0,0,Z/Москва / спб,"тематика, классические стили и темы"
посмотреть,0,тематический,0,фотоальбом_фотоальбомы/альбом_альбомы,для наклеивания фотографий,0,в интернете,0,с темой СССР,0,тематические страницы на разные темы,0,0,Z/Москва / спб,"фоны с темой СССР, обложки, стикеры"
создать,0,семейный,0,фотоальбом_фотоальбомы/альбом_альбомы,семьи своими руками,0,пошагово,0,для стандартного размера фотографий,0,создание для печати,0,0,Z/Москва / спб,программа на русском языке для семейного использования
украсить,0,первый,0,фотоальбом_фотоальбомы/альбом_альбомы,1 класс,0,для школы,0,20х30,0,первые темы и дизайн,0,0,Z/Москва / спб,"хранение, упаковка, доставка"
скачать,0,любительский,0,фотоальбом_фотоальбомы/альбом_альбомы,2 класс,0,в интернете,0,с перелистыванием страниц,0,варианты любительского оформления,0,0,Z/Москва / спб,схемы шаблонов для любителей
купить,0,картонный,0,фотоальбом_фотоальбомы/альбом_альбомы,3 класс,0,онлайн,0,на 10 фотографий,0,картонный дизайн,0,0,Z/Москва / спб,детские обложки из картона с фотографией
создать,0,современный,0,фотоальбом_фотоальбомы/альбом_альбомы,5 класс,0,онлайн,0,на 400 фотографий 10х15,0,современный стиль оформления,0,0,Z/Москва / спб,"заставки, современные фоны, украшения страниц"
оформить онлайн,0,общий,0,фотоальбом_фотоальбомы/альбом_альбомы,6 класс,0,на сайте,0,на 100 фото 10х15,0,бесплатное оформление,0,0,Z/Москва / спб,вырианты обложек для общих фотографий
создать,0,новый,0,фотоальбом_фотоальбомы/альбом_альбомы,7 класс,0,наш класс,0,недорого,0,новый дизайн,0,0,Z/Москва / спб,"профессиональная верстка, новые макеты"
оформить,0,красный,0,фотоальбом_фотоальбомы/альбом_альбомы,8 класс,0,самостоятельно,0,с записями,0,красный цвет в дизайне,0,0,Z/Москва / спб,"красные темы, фоны, стикеры"
создать в группе,0,совместный,0,фотоальбом_фотоальбомы/альбом_альбомы,10 класс,0,одноклассников,0,осень,0,совместное создание для печати,0,0,Z/Москва / спб,варианты дизайна для совместного оформления
найти,0,открытый,0,фотоальбом_фотоальбомы/альбом_альбомы,2 года малыша,0,недорого в интернете,0,с темой космос,0,открытый просмотр тем и оформления,0,0,Z/Москва / спб,"материалы, бумага, обложки"
посмотреть,0,распечатанный,0,фотоальбом_фотоальбомы/альбом_альбомы,3 года,0,в подарок,0,с фото,0,распечатанные примеры на сайте,0,0,Z/Москва / спб,крепление фотографий на распечатанных разворотах
сделать онлайн,0,необычный,0,фотоальбом_фотоальбомы/альбом_альбомы,4 года,0,онлайн,0,на 15 фотографий,0,необычное оформление,0,0,Z/Москва / спб,большой выбор необычных идей
создать,0,крафтовый,0,фотоальбом_фотоальбомы/альбом_альбомы,5 лет,0,онлайн,0,в стиле крафт,0,крафтовые идеи и темы,0,0,Z/Москва / спб,примеры оформления крафтовых проектов
напечатать,0,твердый,0,фотоальбом_фотоальбомы/альбом_альбомы,6 лет,0,из фотографий на заказ,0,на 100 фотографий 10х15,0,высокое качество исполнения,0,0,Z/Москва / спб,твердый переплет
смотреть онлайн,0,поларойдный,0,фотоальбом_фотоальбомы/альбом_альбомы,7 лет,0,в интернете,0,с темой поларойд,0,описание поларойдной темы,0,0,Z/Москва / спб,"шаблоны, обложки"
создать онлайн,0,интересный,0,фотоальбом_фотоальбомы/альбом_альбомы,10 лет,0,самому,0,на 200 фотографий 10х15,0,интересное оформление,0,0,Z/Москва / спб,"макеты, интересный дизайн"
купить,0,необычный,0,фотоальбом_фотоальбомы/альбом_альбомы,18 лет,0,онлайн в интернете,0,для разных фотографий,0,необычное оформление,0,0,Z/Москва / спб,примеры необычного дизайна
заказать,0,именной,0,фотоальбом_фотоальбомы/альбом_альбомы,20 лет,0,в подарок,0,на 600 страниц,0,именное изготовление на заказ,0,0,Z/Москва / спб,"различные переплеты, форматы, именной дизайн"
купить недорого,0,черно-белый,0,фотоальбом_фотоальбомы/альбом_альбомы,25 лет,0,в интернете на сайте,0,для фотографий,0,черно-белое оформление фотографий,0,0,Z/Москва / спб,примеры черно-белого дизайна
оформить онлайн,0,красивый своими руками,0,фотоальбом_фотоальбомы/альбом_альбомы,30 лет,0,пошагово,0,на 100 страниц,0,красивые темы оформления своими руками,0,0,Z/Москва / спб,"красивые фоны, обложки, декор"
заказать,0,юбилейный,0,фотоальбом_фотоальбомы/альбом_альбомы,40 лет,0,на официальном сайте,0,для фото,0,юбилейные темы оформления,0,0,Z/Москва / спб,дизайн для праздников и юбилеев
купить онлайн,0,дорогой,0,фотоальбом_фотоальбомы/альбом_альбомы,50 лет,0,на заказ в интернете,0,для фотографий,0,примеры дорогого оформления,0,0,Z/Москва / спб,дорогой премиум дизайн
заказать,0,классический,0,фотоальбом_фотоальбомы/альбом_альбомы,60 лет,0,онлайн,0,в стиле классика,0,классическое оформление для печати,0,0,Z/Москва / спб,выбор идей для классического стиля
создать,0,архивный,0,фотоальбом_фотоальбомы/альбом_альбомы,70 лет,0,на заказ в интернете,0,на 100 страниц,0,оформление для печати,0,0,Z/Москва / спб,примеры архивных альбомов с фотографиями
создать,0,выпускной,0,фотоальбом_фотоальбомы/альбом_альбомы,на последний звонок,0,формата А4,0,с фотографиями,0,примеры оформления для выпускных,0,0,Z/Москва / спб,стиль для выпускных вечеров
заказать,0,женский,0,фотоальбом_фотоальбомы/альбом_альбомы,на юбилей женщине,0,на сайте в интернете,0,с подписями,0,оформление для женщин,0,0,Z/Москва / спб,женские темы
заказать,0,именной,0,фотоальбом_фотоальбомы/альбом_альбомы,на юбилей мужчине,0,онлайн в интернете,0,для фото в классическом стиле,0,оформление,0,0,Z/Москва / спб,выбор именного стиля и темы
оформить,0,детский,0,фотоальбом_фотоальбомы/альбом_альбомы,праздника,0,бесплатно,0,своими руками,0,примеры детского оформления,0,0,Z/Москва / спб,большой выбор идей для детей
издать,0,дорогой,0,фотоальбом_фотоальбомы/альбом_альбомы,премиум,0,на заказ,0,на 300 фотографий 10х15,0,дорогое оформление онлайн,0,0,Z/Москва / спб,примеры дорогого дизайна
создать онлайн,0,первый,0,фотоальбом_фотоальбомы/альбом_альбомы,1 год жизни,0,для ребенка на сайте,0,для фото,0,первые темы оформления для ребенка,0,0,Z/Москва / спб,примеры дизайна
создать онлайн,0,для выпускников,0,фотоальбом_фотоальбомы/альбом_альбомы,на выпускной 4 класс,0,в интернете онлайн,0,в твердом переплете,0,школьные темы оформления для выпускников,0,0,Z/Москва / спб,фоны для презентации
сделать,0,приватный,0,фотоальбом_фотоальбомы/альбом_альбомы,любимому,0,своими руками пошагово,0,с подписями фотографий,0,приватное оформление для печати онлайн,0,0,Z/Москва / спб,красивые слова и надписи
купить,0,памятный,0,фотоальбом_фотоальбомы/альбом_альбомы,городов,0,на память на сайте,0,фотографиями,0,памятные страницы и оформления,0,0,Z/Москва / спб,запоминающиеся обложки
сделать самому,0,подарочный,0,фотоальбом_фотоальбомы/альбом_альбомы,для новорожденного первый год,0,по месяцам,0,с фото,0,подарочный дизайн,0,0,Z/Москва / спб,простой редакподарочное оформление
купить,0,мужской,0,фотоальбом_фотоальбомы/альбом_альбомы,для друга,0,в подарок,0,с черными страницами,0,брутальное мужское оформление,0,0,Z/Москва / спб,"надписи к фотографиям, мужской стиль"
сделать,0,домашний,0,фотоальбом_фотоальбомы/альбом_альбомы,бабушке,0,в винтажном стиле,0,для черно-белых фотографий,0,домашнее оформление для печати,0,0,Z/Москва / спб,выбор обложек и домашнего стиля
сделать,0,памятный,0,фотоальбом_фотоальбомы/альбом_альбомы,дедушке,0,на память о семье,0,для старых фотографий,0,памятное оформление,0,0,Z/Москва / спб,различные переплеты
сделать,0,стандартный,0,фотоальбом_фотоальбомы/альбом_альбомы,для начинающих,0,своими руками пошагово,0,для фото различных форматов,0,стандартные шаблоны и темы оформления страниц,0,0,Z/Москва / спб,простой редактор
оформить онлайн,0,первый,0,фотоальбом_фотоальбомы/альбом_альбомы,первоклассника,0,на память о школе,0,с веселыми подписями,0,красивые темы оформления,0,0,Z/Москва / спб,первые школьные обложки
сделать,0,семейный,0,фотоальбом_фотоальбомы/альбом_альбомы,родителям,0,на память в подарок,0,с надписями к фото,0,темы оформления,0,0,Z/Москва / спб,классический дизайн
заказать,0,свадебный,0,фотоальбом_фотоальбомы/альбом_альбомы,молодоженов,0,онлайн в интернете,0,на 200 фото 10х15,0,свадебное оформление,0,0,Z/Москва / спб,"красивые обложки, дизайнерские страницы"
создать,0,эксклюзивный,0,фотоальбом_фотоальбомы/альбом_альбомы,для фотографов,0,на сайте на заказ,0,для фотографий,0,эксклюзивные варианты оформления,0,0,Z/Москва / спб,"удобный редактор, готовые шаблоны"
заказать,0,печатный,0,фотоальбом_фотоальбомы/альбом_альбомы,мужу,0,в интернет магазине,0,с подписями к фотографиям,0,печатные макеты для типографии,0,0,Z/Москва / спб,"красивые страницы для печати, обложки"
посмотреть,0,детский,0,фотоальбом_фотоальбомы/альбом_альбомы,baby,0,в интернете,0,дневник,0,примеры детского оформления,0,0,Z/Москва / спб,"детские фоны, обложки, украшалки"
оформить,0,военный,0,фотоальбом_фотоальбомы/альбом_альбомы,ко Дню Победы,0,на сайте,0,с темой войны,0,примеры военного оформления,0,0,Z/Москва / спб,лаконичный дизайн ко Дню Победы
купить,0,большой семейный,0,фотоальбом_фотоальбомы/альбом_альбомы,на годовщину свадьбы,0,в подарок,0,дешево,0,примеры семейного оформления для больших фотографий,0,0,Z/Москва / спб,"стильные обложки, большие форматы"
оформить,0,индивидуальный,0,фотоальбом_фотоальбомы/альбом_альбомы,выпускника детского сада,0,онлайн на сайте,0,на 30 фото,0,индивидуальные варианты оформления,0,0,Z/Москва / спб,"простой редактор, индивидуальные страницы и обложки"
купить,0,винтажный,0,фотоальбом_фотоальбомы/альбом_альбомы,сестре,0,онлайн в интернете,0,на 40 фото,0,винтажные стили оформления,0,0,Z/Москва / спб,винтажный ретро-дизайн
сделать,0,яркий,0,фотоальбом_фотоальбомы/альбом_альбомы,в виде книги,0,своими руками на заказ,0,для ярких фотографий,0,яркий стиль оформления для фото,0,0,Z/Москва / спб,"яркие фоны, обложки, темы"
создать,0,виртуальный,0,фотоальбом_фотоальбомы/альбом_альбомы,детство,0,онлайн,0,с перелыстыванием страниц,0,виртуальное оформление,0,0,Z/Москва / спб,простой онлайн-редактор
заказать,0,школьный,0,фотоальбом_фотоальбомы/альбом_альбомы,1 сентября,0,на официальном сайте онлайн,0,для празничных фото,0,школьные фоны и темы дизайна,0,0,Z/Москва / спб,бесплатное оформление
оформить,0,комбинированный,0,фотоальбом_фотоальбомы/альбом_альбомы,для новорожденного первый год жизни,0,самому,0,на стандартный размер фото 15х21 и 10х15,0,примеры комбинированного оформления,0,0,Z/Москва / спб,комбинированные темы дизайн
купить,0,веселый,0,фотоальбом_фотоальбомы/альбом_альбомы,первый год малыша,0,на заказ,0,для детских фото из жизни малыша,0,веселые страницы для печати,0,0,Z/Москва / спб,веселый дизайн для ребенка
создать,0,памятный,0,фотоальбом_фотоальбомы/альбом_альбомы,коллеге,0,на память на заказ,0,в виде открытки,0,памятные темы и идеи оформления,0,0,Z/Москва / спб,красивая упаковка
купить,0,креативный,0,фотоальбом_фотоальбомы/альбом_альбомы,для влюбленных,0,любимому в подарок,0,с фотографиями,0,креативное оформление,0,0,Z/Москва / спб,"креативные темы, обложки, подписи"
создать,0,классный,0,фотоальбом_фотоальбомы/альбом_альбомы,руководителю,0,онлайн в подарок,0,в виде книги,0,классное оформление,0,0,Z/Москва / спб,"подписи, стихи, цитаты"
сделать,0,тематический,0,фотоальбом_фотоальбомы/альбом_альбомы,животных,0,на память,0,любимых питомцев,0,варианты тематического оформления и печати,0,0,Z/Москва / спб,"библиотека тем, фонов, стикеров и обложек"
