title,"${setText(w1, 'Купить')}  ${setText(w2, 'детский')}  ${setText(w3, 'фотоальбом')} ${setText(w4, ' на выпускной')} ${setText(w9s, ' в Москве ')} .${setText(w3s, 'Фотоальбомы')}  ${setText(w6, 'для фото ')}  ${setText(w5, 'онлайн ')} . Цены. Печать.${setText(w7, 'Оформление ')} . ${setText(w10, 'Обложки ')} .",,,,,,,,,,,,,,
сделать,0,крутой,0,фотоальбом_фотоальбомы/альбом_альбомы,для парня,0,своими руками на день рождения,0,для крутых фото,0,идеи крутого оформления,0,0,Z/Москва / спб,удобный онлайн редактор
купить,0,Z,0,фотоальбом_фотоальбомы/альбом_альбомы,первый для девочки,0,на заказ в интернете,0,для фото первого года жизни,0,нежное оформление,0,0,Z/Москва / спб,"разные переплеты, красивый дизайн"
заказать онлайн,0,шуточный,0,фотоальбом_фотоальбомы/альбом_альбомы,детский мир,0,в интернет-магазине,0,без кармашков,0,шуточный дизайн для оформления,0,0,Z/Москва / спб,бумажные страницы с шуточными темами
заказать,0,большой детский,0,фотоальбом_фотоальбомы/альбом_альбомы,на крестины,0,в интернете,0,для больших и маленьких фото,0,темы оформления для детей,0,0,Z/Москва / спб,большие детские форматы
оформить онлайн,0,детский,0,фотоальбом_фотоальбомы/альбом_альбомы,от 0 до года,0,на сайте,0,для фото,0,детские темы оформления,0,0,Z/Москва / спб,детский дизайн страниц и обложек
купить,0,новорожденный,0,фотоальбом_фотоальбомы/альбом_альбомы,"привет, я родился",0,в интернет-магазине ручной работы,0,для фотографий первого года жизни,0,оформление и дизайн для новорожденных,0,0,Z/Москва / спб,"записи, фоны, стикеры"
сделать,0,самодельный,0,фотоальбом_фотоальбомы/альбом_альбомы,на рождение ребенка,0,своими руками пошагово на компьютере,0,с фото,0,мастер-классы по оформлению самодельных тем,0,0,Z/Москва / спб,электронная программа
создать,0,декоративный,0,фотоальбом_фотоальбомы/альбом_альбомы,на рождение,0,как подарок на день рождения,0,моя семья,0,примеры декоративного оформления своими руками,0,0,Z/Москва / спб,"декоративные обложки, фоны, стикеры"
заказать,0,белый,0,фотоальбом_фотоальбомы/альбом_альбомы,беременности,0,на память,0,для черно-белых фото,0,стильное оформление белых тем,0,0,Z/Москва / спб,"белые страницы, бумажные листы"
создать,0,самый лучший,0,фотоальбом_фотоальбомы/альбом_альбомы,для семейной пары,0,в подарок на юбилей свадьбы,0,на 200 фото,0,идеи оформления для самых лучших фото,0,0,Z/Москва / спб,"конкурсы, самые лучшие поздравления"
заказать,0,глянцевый,0,фотоальбом_фотоальбомы/альбом_альбомы,для средней школы,0,в подарок ученикам школы,0,для фото,0,глянцевая и матовая ламинация для обложек,0,0,Z/Москва / спб,производство и печать в типографии
оформить,0,винтажный,0,фотоальбом_фотоальбомы/альбом_альбомы,под старину,0,на компьютере самостоятельно,0,для старинных фотографий,0,винтажный стиль оформления,0,0,Z/Москва / спб,надписи и поздравления
заказать,0,стильный,0,фотоальбом_фотоальбомы/альбом_альбомы,для организации,0,онлайн,0,для фотографий,0,стильный дизайн,0,0,Z/Москва / спб,печать в типографии
заполнить,0,праздничный,0,фотоальбом_фотоальбомы/альбом_альбомы,мой любимый детский сад,0,самостоятельно,0,тема сказка,0,праздничное оформление,0,0,Z/Москва / спб,пошаговые инструкции оформления самостоятельно
сделать,0,белый,0,фотоальбом_фотоальбомы/альбом_альбомы,невесты,0,своими руками на память о свадьбе,0,для черно-белых фотографий,0,черно-белое оформление,0,0,Z/Москва / спб,"эскизы, белые листы, бумажные страницы"
оформить,0,красивый дорогой,0,фотоальбом_фотоальбомы/альбом_альбомы,на золотую свадьбу,0,онлайн своими руками в подарок родителям,0,с фотографиями на юбилей свадьбы,0,дорогое оформление,0,0,Z/Москва / спб,"красивые надписи, фразы, стихи"
заказать,0,однотонный,0,фотоальбом_фотоальбомы/альбом_альбомы,для бизнеса,0,на заказ онлайн,0,недорого,0,однотонное оформление,0,0,Z/Москва / спб,"фоны для оформления, готовые однотонные макеты"
сделать,0,памятный,0,фотоальбом_фотоальбомы/альбом_альбомы,отпуска,0,на память о путешествии,0,для фотографий,0,памятные темы оформления для путешествия,0,0,Z/Москва / спб,"выбор фонов, обложек на память об отпуске"
создать,0,родословный,0,фотоальбом_фотоальбомы/альбом_альбомы,для внучки,0,на память о семье,0,в виде книги,0,идеи оформления родословной книги,0,0,Z/Москва / спб,"типы, форматы, переплеты"
создать,0,качественный,0,фотоальбом_фотоальбомы/альбом_альбомы,на год отношений,0,в подарок,0,с фото и комментариями,0,качественное изготовление,0,0,Z/Москва / спб,"качественные программы, векторы, графика, акварель"
сделать,0,детский,0,фотоальбом_фотоальбомы/альбом_альбомы,принцессы,0,своими руками,0,с фотографиями малышки,0,детское сказочное оформление,0,0,Z/Москва / спб,удобный онлайн редактор для детских фотографий
оформить,0,школьный,0,фотоальбом_фотоальбомы/альбом_альбомы,для гимназии,0,онлайн на сайте,0,с фотографиями учеников,0,идеи для школьного дизайна,0,0,Z/Москва / спб,инструкции по оформлению школьных фото
оформить,0,зимний,0,фотоальбом_фотоальбомы/альбом_альбомы,отдыха,0,онлайн на компьютере самостоятельно,0,с фото семьи,0,зимние темы графического оформления,0,0,Z/Москва / спб,"зимние фоны, акварельные обложки"
сделать,0,спортивный,0,фотоальбом_фотоальбомы/альбом_альбомы,для подростка,0,на заказ онлайн,0,с фото на тему спорт,0,спортивный дизайн,0,0,Z/Москва / спб,"акции, распродажи, пошаговые инструкции"
заказать,0,дорожный,0,фотоальбом_фотоальбомы/альбом_альбомы,путешественника,0,онлайн,0,с фото путешествия,0,дорожные темы оформления,0,0,Z/Москва / спб,"удобный онлайн редактор, готовые дорожные страницы"
купить,0,милый,0,фотоальбом_фотоальбомы/альбом_альбомы,первый год жизни малыша,0,на заказ онлайн,0,для первых фотографий,0,милые темы оформления,0,0,Z/Москва / спб,"картинки, стикеры, обложки"
скачать,0,вертикальный,0,фотоальбом_фотоальбомы/альбом_альбомы,от года до 7 лет,0,на сайте в интернете,0,для разных фото,0,темы для вертикальных страниц,0,0,Z/Москва / спб,"вертикальные форматы, онлайн-редактор"
заказать,0,дизайнерский,0,фотоальбом_фотоальбомы/альбом_альбомы,история нашей любви,0,как подарок любимому своими руками,0,для совместных фото,0,дизайнерское оформление от профессионалов,0,0,Z/Москва / спб,дизайнерские картинки для оформления
заказать,0,небольшой,0,фотоальбом_фотоальбомы/альбом_альбомы,на годик,0,своими руками,0,небольшого формата 20х20,0,небольшие форматы,0,0,Z/Москва / спб,"темы, фоны, подписи для небольших альбомов"
сделать,0,скетчбук,0,фотоальбом_фотоальбомы/альбом_альбомы,для подруги на день рождения,0,в подарок своими руками,0,с фотографиями,0,готовые темы оформления скетчбука,0,0,Z/Москва / спб,"фоторамки, украшения, декор"
создать,0,памятный,0,фотоальбом_фотоальбомы/альбом_альбомы,воспитателю,0,в подарок на память от родителей и детей,0,с фото,0,темы для памятных подарков,0,0,Z/Москва / спб,памятные фразы и выражения
заказать,0,мужской,0,фотоальбом_фотоальбомы/альбом_альбомы,для папы,0,онлайн в подарок,0,с подписями для фотографий,0,варианты мужского стиля,0,0,Z/Москва / спб,"портреты, надписи, слова с мужскими поздравлениями"
купить,0,школьный,0,фотоальбом_фотоальбомы/альбом_альбомы,первый раз в первый класс,0,в интернете,0,дешево,0,примеры школьного оформления для первоклашек,0,0,Z/Москва / спб,"слова, школьные стихи, подписи"
сделать,0,подарочный,0,фотоальбом_фотоальбомы/альбом_альбомы,"до свидания, детский сад",0,своими руками,0,для фотографий детей,0,подарочные темы для оформления,0,0,Z/Москва / спб,"подписи, стихи, подарочные коробки"
заказать,0,традиционный,0,фотоальбом_фотоальбомы/альбом_альбомы,для дочери,0,в интернете онлайн,0,для фото,0,традиционный дизайн,0,0,Z/Москва / спб,"традиционные темы, обложки, переплеты"
оформить онлайн,0,Z,0,фотоальбом_фотоальбомы/альбом_альбомы,для сына,0,онлайн в интернете,0,в подарок с фотографиями,0,идеи оформления онлайн фотографий,0,0,Z/Москва / спб,"обложки, страницы, портреты"
сделать,0,семейный,0,фотоальбом_фотоальбомы/альбом_альбомы,для мамы,0,в подарок,0,с местом для записей,0,идеи оформления для семьи,0,0,Z/Москва / спб,"семейные темы,обложки, стикеры, надписи"