title,"${setText(w1, 'Купить')}  ${setText(w2, 'детский')}  ${setText(w3, 'фотоальбом')} ${setText(w4, ' на выпускной')} ${setText(w9s, ' в Москве ')} .${setText(w3s, 'Фотоальбомы')}  ${setText(w6, 'для фото ')}  ${setText(w5, 'онлайн ')} . Цены. Печать.${setText(w7, 'Оформление ')} . ${setText(w10, 'Обложки ')} .",,,,,,,,,,,,,,
description,"${setText(w2, 'Детский ')}  ${setText(w3, 'фотоальбом')}  ${setText(w5, 'онлайн ')}  ${setText(w9s, ' в Москве ')}  – это U4U.ru. ${setText(w1, 'Купить')} ${setText(w3s, 'фотоальбомы')}  ${setText(w6, 'для фото ')}  можно на нашем сайте. Цена от 390 р. Бесплатные дизайн. Печать на своем производстве. ${setText(w7, 'Оформление ')} . ${setText(w10, 'Обложки ')} . ${setText(w2, 'Детский ')}  ${setText(w3, 'фотоальбом')}  ${setText(w4, 'на выпускной')}  ${setText(w5, 'онлайн')}  – это отличный подарок, его легко ${setText(w1, 'купить')}  и наслаждаться любимыми фотографиями. ${setText(w2, 'Детский ')}  ${setText(w3, 'фотоальбом')}  ${setText(w6, 'для фото ')}  ${setText(w9s, ' в Москве ')} . Работаем 24/7.${setText(w3s, 'Фотоальбомы')}  от U4U будут радовать Вас долгие годы.",,,,,,,,,,,,,,
CEO,"${setText(w2, 'Детский ')}  ${setText(w3, 'фотоальбом')} ${setText(w4, ' на выпускной')} ${setText(w9s, ' в Москве ')}  - недорогой и желанный подарок для любого человека, который можно ${setText(w1, 'купить')}  на нашем сайте. Большое разнообразие вариантов и возможностей нашего сервиса  порадуют даже самого взыскательного заказчика.${setText(w3s, 'Фотоальбомы')}  на U4U.ru – это бесплатные шаблоны от лучших дизайнеров страны, простой онлайн редактор и печать безупречного качества. Предлагаем${setText(w7, 'оформление ')} , ${setText(w10, 'обложки ')} . Загружайте и печатайте фотографии, чтобы сохранить яркие эмоции своей жизни для себя и близких. ${setText(w2, 'Детский ')}  ${setText(w3, 'фотоальбом')}  ${setText(w5, 'онлайн ')}  ${setText(w9, ' в Москве ')}  это быстро, просто и совсем недорого. Наши цены вас порадуют – от 390 рублей за многостраничный ${setText(w3, 'фотоальбом')} . Мы постарались сделать процесс создания макета максимально простым и удобным.${setText(w3s, 'Фотоальбомы')}  ${setText(w6, 'для фото ')}  ${setText(w9s, ' в Москве ')}  – самые актуальные предложения на нашем онлайн сервисе, высокое качество печати и быстрые сроки исполнения любого заказа. Срок изготовления от 1 дня. ${setText(w2, 'Детский ')}  ${setText(w3, 'фотоальбом')}  легко ${setText(w1, 'купить')}  и сохранить бесценные воспоминания на долгие годы. ${setText(w2, 'Детский ')}  ${setText(w3, 'фотоальбом')}  ${setText(w6, 'для фото ')}  ${setText(w5, 'онлайн ')}  ${setText(w9s, ' в Москве ')}  - это печать на собственном современном производстве. Удобная упаковка. Доставка по России ${setText(w9i, 'и Москве ')} курьером, почтой и в пункты самовывоза. Бесплатный самовывоз из офиса U4U в Москве. Мы информируем заказчика о каждом этапе прохождения и готовности его заказа SMS или e-mail уведомлениями.${setText(w3s, 'Фотоальбомы')} ${setText(w4, ' на выпускной')} ${setText(w9s, ' в Москве ')}  - это ваша история на нашем сайте. Сохраняйте драгоценные моменты жизни для себя и будущих поколений с фотоальбомами от U4U.ru.",,,,,,,,,,,,,,
купить,0,детский,0,фотоальбом_фотоальбомы/альбом_альбомы,на выпускной,0,на заказ,0,для фото,0,идеи на выпускной,0,0,Z/ Москва/ спб/ Екатеринбург/ Новосибирск,"обложки, страницы, детский дизайн"
сделать,0,выпускной,0,фотоальбом_фотоальбомы/альбом_альбомы,в детский сад,0,в интернете,0,своими руками,0,оформление,0,0,Z/ Москва/ спб/ Екатеринбург/ Новосибирск,"страницы, шаблоны на выпускной, онлайн-редактор"
скачать,0,школьный,0,фотоальбом_фотоальбомы/альбом_альбомы,класса,0,в интернет магазине,0,с фотографиями,0,изготовление для школы,0,0,Z/ Москва/ спб/ Екатеринбург/ Новосибирск,"подписи, школьные цитаты, оформление"
заказать,0,скрапбукинг,0,фотоальбом_фотоальбомы/альбом_альбомы,для начинающих,0,онлайн,0,в виде книги,0,создание,0,0,Z/ Москва/ спб/ Екатеринбург/ Новосибирск,"программа создания, примеры скрапбукинг оформления"
создать,0,Z,0,фотоальбом_фотоальбомы/альбом_альбомы,лета,0,ручной работы,0,на заказ,0,оформление и создание для печати,0,0,Z/ Москва/ спб/ Екатеринбург/ Новосибирск,"размеры, блоки для фото, шаблоны"
купить в магазине,0,магнитный,0,фотоальбом_фотоальбомы/альбом_альбомы,года,0,в интернете,0,для фото,0,темы для магнитных фото первого года,0,0,Z/ Москва/ спб/ Екатеринбург/ Новосибирск,"разные шаблоны, примеры оформления"
оформить,0,новорожденный,0,фотоальбом_фотоальбомы/альбом_альбомы,первого года,0,на сайте,0,10х15,0,оформление своими руками для новорожденных,0,0,Z/ Москва/ спб/ Екатеринбург/ Новосибирск,"качественная бумага, твердый переплет"
сделать,0,красивый,0,фотоальбом_фотоальбомы/альбом_альбомы,на выпускной в детский сад,0,своими руками пошагово,0,в виде книги,0,мастер-классы,0,0,Z/ Москва/ спб/ Екатеринбург/ Новосибирск,"красивые фона, надписи, стихи"
сделать своими руками,0,дорогой,0,фотоальбом_фотоальбомы/альбом_альбомы,выпускника,0,онлайн,0,на 200 фото,0,идеи дорогого оформления,0,0,Z/ Москва/ спб/ Екатеринбург/ Новосибирск,"названия, подписи, стихи"
оформить,0,первый,0,фотоальбом_фотоальбомы/альбом_альбомы,для новорожденного,0,на заказ,0,на 500 фотографий,0,идеи первого оформления своими руками,0,0,Z/ Москва/ спб/ Екатеринбург/ Новосибирск,"тексты, первые стихи, заголовки"
смотреть,0,частный,0,фотоальбом_фотоальбомы/альбом_альбомы,Z,0,на компьютере,0,с фотографиями,0,просмотр частных тем оформления,0,0,Z/ Москва/ спб/ Екатеринбург/ Новосибирск,"подписи, тексты, заголовки"
напечатать,0,семейный,0,фотоальбом_фотоальбомы/альбом_альбомы,на юбилей,0,своими руками,0,недорого,0,"поздравления, стихи для семьи",0,0,Z/ Москва/ спб/ Екатеринбург/ Новосибирск,"семейный дизайн, рамки, стикеры"
распечатать,0,школьный,0,фотоальбом_фотоальбомы/альбом_альбомы,ребенка,0,на заказ,0,самому,0,профессиональная печать в типографии,0,0,Z/ Москва/ спб/ Екатеринбург/ Новосибирск,"образцы, примеры работ для школы"
загрузить,0,большой,0,фотоальбом_фотоальбомы/альбом_альбомы,для школы,0,своими руками пошагово для начинающих,0,для фото,0,стиль и идеи оформления,0,0,Z,"большие форматы, шаблоны, надписи"
посмотреть,0,белый,0,фотоальбом_фотоальбомы/альбом_альбомы,для девушки,0,в подарок,0,на 500 фото,0,"изготовление на заказ, белое оформление",0,0,Z/ Москва/ спб/ Екатеринбург/ Новосибирск,"образцы, большая галерея белых тем"
изготовить,0,школьный,0,фотоальбом_фотоальбомы/альбом_альбомы,4 класс,0,на память,0,для фотографий 10х15,0,проекты для школы,0,0,Z/ Москва/ спб/ Екатеринбург/ Новосибирск,"поздравления, школьные подписи"
сделать на заказ,0,свадебный,0,фотоальбом_фотоальбомы/альбом_альбомы,на свадьбу,0,в магазине,0,с подписями,0,свадебное изготовление молодоженам,0,0,Z/ Москва/ спб/ Екатеринбург/ Новосибирск,"твердая обложка, свадебный переплет"
создать онлайн,0,новогодний,0,фотоальбом_фотоальбомы/альбом_альбомы,для девочки,0,2021,0,на 600 фото,0,"новогоднее оформление, примеры новогоднего дизайна",0,0,Z/ Москва/ спб/ Екатеринбург/ Новосибирск,мягкий и твердый переплеты
посмотреть,0,хороший,0,фотоальбом_фотоальбомы/альбом_альбомы,9 класс,0,разных видов,0,на 300 фото,0,с хорошим оформлением внутри,0,0,Z/ Москва/ спб/ Екатеринбург/ Новосибирск,простой онлайн редактор
создать и напечатать,0,бумажный,0,фотоальбом_фотоальбомы/альбом_альбомы,первого года,0,А4,0,в книжном переплете,0,мастер-класс для начинающих,0,0,Z/ Москва/ спб/ Екатеринбург/ Новосибирск,"бумажные страницы, надежный переплет"
купить А4,0,индивидуальный,0,фотоальбом_фотоальбомы/альбом_альбомы,11 класс,0,на кольцах,0,с текстом,0,с индивидуальным оформление страниц,0,0,Z/ Москва/ спб/ Екатеринбург/ Новосибирск,"стихи, надписи, индивидуальные цитаты"
сделать пошагово для начинающих,0,детский,0,фотоальбом_фотоальбомы/альбом_альбомы,малыша,0,онлайн бесплатно,0,в коробке,0,оформление листов для детей,0,0,Z/ Москва/ спб/ Екатеринбург/ Новосибирск,"заголовоки, детские подписи к фотографиям"
купить недорого в интернете,0,подарочный,0,фотоальбом_фотоальбомы/альбом_альбомы,для женщины,0,на заказ,0,для снимков,0,подарочное оформление внутри своими руками,0,0,Z/ Москва/ спб/ Екатеринбург/ Новосибирск,"слова, фразы из жизни, подарочные надписи"
купить формата А4,0,школьный,0,фотоальбом_фотоальбомы/альбом_альбомы,выпускника детского сада,0,своими руками пошагово,0,в виде резентации,0,"изготовление для выпускников, школьные темы",0,0,Z/ Москва/ спб/ Екатеринбург/ Новосибирск,"промокоды, акции, школьные скидки"
оформить,0,военный,0,фотоальбом_фотоальбомы/альбом_альбомы,1941 - 1945,0,в интернете,0,c описанием,0,военное оформление,0,0,Z/ Москва/ спб/ Екатеринбург/ Новосибирск,"онлайн редактор, военные темы дизайна"
оформить,0,личный,0,фотоальбом_фотоальбомы/альбом_альбомы,для мальчика,0,для начинающих,0,с записями,0,личные темы оформления,0,0,Z/ Москва/ спб/ Екатеринбург/ Новосибирск,фоторедактор для начинающих
создать,0,именной,0,фотоальбом_фотоальбомы/альбом_альбомы,семья,0,отзывы,0,на 10 фото,0,"именные варианты оформления, идеи",0,0,Z/ Москва/ спб/ Екатеринбург/ Новосибирск,программа для создания именного дизайна
сделать,0,маленький,0,фотоальбом_фотоальбомы/альбом_альбомы,на рождение,0,своими руками,0,в виде книги,0,"оформление надписями, темы для маленьких",0,0,Z/ Москва/ спб/ Екатеринбург/ Новосибирск,маленький мир фотографий своими руками
сделать пошагово для начинающих,0,первый для новорожденного,0,фотоальбом_фотоальбомы/альбом_альбомы,скрапбукинг своими руками,0,с фото своими руками,0,20 листов,0,мастер-класс по изготовлению,0,0,Z/ Москва/ спб/ Екатеринбург/ Новосибирск,"шаблоны для фотоблоков, первый дизайн для новорожденных"
изготовить,0,памятный,0,фотоальбом_фотоальбомы/альбом_альбомы,на выпускной 11 класс,0,в наборе,0,в виде книги,0,"описание, памятное оформление",0,0,Z/ Москва/ спб/ Екатеринбург/ Новосибирск,"размеры фото, разные форматы"
сделать,0,школьный,0,фотоальбом_фотоальбомы/альбом_альбомы,на выпускной 9 класс,0,как серия,0,на 300 фотографий,0,школьные поздравления,0,0,Z/ Москва/ спб/ Екатеринбург/ Новосибирск,форматы фотографий для школы
оформить,0,армейский,0,фотоальбом_фотоальбомы/альбом_альбомы,армия,0,Z,0,на 10 фотографий,0,армейские темы оформления обложки,0,0,Z/ Москва/ спб/ Екатеринбург/ Новосибирск,"размеры фотографий, блоки, армейские шаблоны"
оформить,0,мини,0,фотоальбом_фотоальбомы/альбом_альбомы,image art,0,с телефона,0,на 1000 фотографий,0,мини темы для оформления с телефона,0,0,Z/ Москва/ спб/ Екатеринбург/ Новосибирск,стандарные и мини размеры
купить,0,оригинальный,0,фотоальбом_фотоальбомы/альбом_альбомы,на день рождения,0,на официальном сайте,0,на 200 фотографий,0,оригинальные темы оформления,0,0,Z/ Москва/ спб/ Екатеринбург/ Новосибирск,"виды, форматы, переплеты, оригинальный дизайн"
купить,0,классический,0,фотоальбом_фотоальбомы/альбом_альбомы,первого года жизни,0,заказ в виде книги,0,на 600 фотографий,0,классическая фотопечать на заказ,0,0,Z/ Москва/ спб/ Екатеринбург/ Новосибирск,"блоки для фото, классический твердый переплет"
скачать бесплатно,0,цифровой,0,фотоальбом_фотоальбомы/альбом_альбомы,Z,0,ru,0,на 400 фото,0,изготовление на заказ с цифрового носителя,0,0,Z,цифровые бесплатные программы на русском
заказать,0,именной на заказ,0,фотоальбом_фотоальбомы/альбом_альбомы,для любимой,0,с темой любовь,0,на 100 фото,0,"онлайн загрузка фото, именные темы на заказ",0,0,Z/ Москва/ спб/ Екатеринбург/ Новосибирск,"переплеты, размеры, обложки"
сделать,0,памятный на заказ,0,фотоальбом_фотоальбомы/альбом_альбомы,для мужчины,0,самостоятельно на компьютере,0,на 36 фото,0,памятное арт оформление,0,0,Z/ Москва/ спб/ Екатеринбург/ Новосибирск,"развороты, страницы, обложки"
создать,0,прикольный,0,фотоальбом_фотоальбомы/альбом_альбомы,индивидуальный выпускников детского сада,0,пошагово,0,на 400 фотографий,0,прикольное оформление для фото,0,0,Z/ Москва/ спб/ Екатеринбург/ Новосибирск,"стандартные размеры, прикольные темы"
заказать,0,женский,0,фотоальбом_фотоальбомы/альбом_альбомы,для подруги,0,на официальном сайте,0,20 фото,0,женский дизайн,0,0,Z/ Москва/ спб/ Екатеринбург/ Новосибирск,каталог примеров работ для женщины
создать онлайн,0,морской,0,фотоальбом_фотоальбомы/альбом_альбомы,путешествия,0,бесплатно,0,с морской темой,0,печать разноформатных фотографий из путешествия,0,0,Z/ Москва/ спб/ Екатеринбург/ Новосибирск,"морские обложки, страницы, стикеры"
купить недорого,0,стильный,0,фотоальбом_фотоальбомы/альбом_альбомы,для новорожденного первый год,0,с записями,0,на 50 фотографий,0,печать в типографии,0,0,Z/ Москва/ спб/ Екатеринбург/ Новосибирск,"стильные шаблоны, блоки, стикеры бесплатно"
купить,0,красивый,0,фотоальбом_фотоальбомы/альбом_альбомы,цветов,0,в подарок,0,на 20 фотографий,0,красивое цветочное оформление,0,0,Z/ Москва/ спб/ Екатеринбург/ Новосибирск,"темы цветов, природы, времен года"
сделать,0,свадебный,0,фотоальбом_фотоальбомы/альбом_альбомы,скрапбукинг пошагово,0,своими руками пошагово с фото,0,на 100 фотографий,0,оформление своими руками,0,0,Z/ Москва/ спб/ Екатеринбург/ Новосибирск,заготовки для свадебного оформления
скачать,0,электронный,0,фотоальбом_фотоальбомы/альбом_альбомы,начальная школа,0,бесплатно,0,самостоятельно,0,электронный просмотр вариантов,0,0,Z/ Москва/ спб/ Екатеринбург/ Новосибирск,электронные тексты на русском языке
заказать,0,юбилейный,0,фотоальбом_фотоальбомы/альбом_альбомы,родителям,0,недорого в интернете,0,быстро,0,варианты юбилейного оформления,0,0,Z/ Москва/ спб/ Екатеринбург/ Новосибирск,проекты работ юбилейного дизайна
купить недорого,0,семейный,0,фотоальбом_фотоальбомы/альбом_альбомы,для старых фотографий,0,на заказ,0,хорошего качества,0,оформление семейных фото,0,0,Z/ Москва/ спб/ Екатеринбург/ Новосибирск,удобный онлайн сервис
купить,0,готовый,0,фотоальбом_фотоальбомы/альбом_альбомы,для больших фотографий,0,в интернет-магазине,0,недорого,0,примеры готового оформления,0,0,Z/ Москва/ спб/ Екатеринбург/ Новосибирск,готовые подписи к фотографиям
купить,0,первый,0,фотоальбом_фотоальбомы/альбом_альбомы,1 год,0,в интернет-магазине,0,срочно,0,первое изготовление,0,0,Z/ Москва/ спб/ Екатеринбург/ Новосибирск,"первые стихи, надписи, тексты"
смотреть,0,смешной,0,фотоальбом_фотоальбомы/альбом_альбомы,детские годы,0,видео,0,30х30,0,смешные поздравления для детей,0,0,Z/Москва / спб,"шаблоны страниц, индивидуальные обложки"
оформить,0,выпускной,0,фотоальбом_фотоальбомы/альбом_альбомы,школьные годы,0,в электронном виде,0,с разными форматами фотографий,0,оформление страниц для выпускного,0,0,Z/Москва / спб,подписи к выпускным фотографиям
найти,0,школьный,0,фотоальбом_фотоальбомы/альбом_альбомы,выпускника школы,0,на заказ,0,для фото,0,школьное оформление бесплатно,0,0,Z/Москва / спб,галерея работ
создать,0,бумажный,0,фотоальбом_фотоальбомы/альбом_альбомы,для выпускника 4 класса,0,на выпуск,0,с бумажными страницами,0,создание в группе,0,0,Z/Москва / спб,"картинки, стикеры, фоны"
сделать самому,0,выпускной,0,фотоальбом_фотоальбомы/альбом_альбомы,для выпускника 9 класса,0,из фотографий на заказ,0,дешево,0,стоимость,0,0,Z/Москва / спб,рамки для фото
