title,"${setText(w3, 'Фотокнига')} ${setText(w4, 'на выпускной')} ${setText(w6, 'на заказ')} ${setText(w1, 'купить')} на U4U.ru. ${setText(w2, 'Детская')} ${setText(w3, 'фотокнига')} ${setText(w6, 'для фото')} ${setText(w9s, 'в Москве')}. ${setText(w7, 'Оформление')}. ${setText(w10, 'Обложки')}. Цены. Печать на своем производстве.",,,,,,,,,,,,,,
description,"${setText(w3, 'Фотокнига')} ${setText(w4, 'на выпускной')} ${setText(w6, 'для фото')} сохранит счастливые моменты жизни. ${setText(w1, 'Купить')} ${setText(w3s, 'фотокниги')} можно на нашем сайте. Цены на печать от 390 р. ${setText(w9s, 'в Москве')}. Предлагаем ${setText(w7, 'оформление')}. ${setText(w10, 'Обложки')}. ${setText(w2, 'Детская')} ${setText(w3, 'фотокнига')} ${setText(w5, 'на заказ')} – для красивых фотографий. ${setText(w3, 'Фотокнига')} ${setText(w4, 'на выпускной')}, ее легко ${setText(w1, 'купить')} для красивых фотографий. Бесплатные шаблоны и макеты.  ${setText(w3, 'Фотокнига')} ${setText(w9s, 'в Москве')} – всегда отличный и недорогой подарок. ",,,,,,,,,,,,,,
CEO,"${setText(w3s, 'Фотокниги’)} - это отличная идея для хорошего подарка ребенку, родным или любимому человеку, который вы можете ${setText(w1, 'купить’)} на сайте нашей компании. ${setText(w3, 'Фотокнига ')} ${setText(w4, 'выпускной’)}  ${setText(w9s, 'в Москве ')} от онлайн сервиса U4U.ru – это бесплатные шаблоны от профессиональных дизайнеров высокого уровня, удобный и интуитивно понятный онлайн редактор, с которым справится даже начинающий пользователь интернета. Мы предлагаем варианты полность готовых дизайнерских макетов на разные темы с автоматическим размещением ваших фотографий. Для всей продукции мы гарантируем печать и изготовление самого высокого качества. ${setText(w2, 'Детская ')} ${setText(w3, 'фотокнига ')} ${setText(w5, 'на заказ ')} - это очень быстро, просто и совсем недорого. У нас очень доступные цены на всю продукцию – от 390 р. за многостраничную фотокнигу. Посмотрите актуальные предложения по скидкам, купонам и акциям на ${setText(w3s, 'фотокниги')} ${setText(w4, 'выпускной’)}  и другую продукцию на сайте нашей компании.  Для удобства работы заказчиков мы внедряем иновационные решения для работы редактора, постоянно расширяем галерею тем дизайна, расширяем возможности сервиса по упаковке и доставке полиграфической продукции. Предлагаем посмотреть ${setText(w7, 'оформление')}  у нас на сайте и выбрать понравившийся дизайн для своей фотокниги. Вы можете сами почувствовать себя творцом, используя инструменты для оформления своего шедевра. Все эти составляющие плюс ${setText(w10, 'обложки’)} и вы получите красивую фотокнигу практически на любую тему. ${setText(w3, 'Фотокнига ')} ${setText(w6, 'для фото’)} на U4U.ru это отличный выбор, ее можно ${setText(w1, 'купить’)}  на нашем сайте за несколько минут  и сохранить дорогие для вас воспоминания на долгие годы. Срок изготовления продукции от 1 дня. ${setText(w2, 'Детский’)} ${setText(w3, 'фотокнига ')} ${setText(w6, 'для фото’)} от фабрики фотокниг U4U - это печать на профессиональном оборудовании современного производства, недорогие цены, надежная упаковка и быстрая доставка. Доставка осуществляется по всей России, ${setText(w9a, 'Москве’)} курьером, почтой России и в пункты самовывоза. На выбор предлагаем несколько самых известных компаний по доставке с получением трек-номера вашего заказа. Для столичных жителей предусмотрен бесплатный самовывоз из офиса U4U в Москве. Для удобства заказчиков мы информируем их о каждом этапе производства и готовности заказа SMS или e-mail уведомлениями. ${setText(w3, 'Фотокнига ')} - это бесценные мгновения счастья, которые можно сохранить в памяти на долгие годы. Такой подарок придется по душе любому человеку. Сохраняйте впечатления для cебя и будущих поколений с фотокнигами U4U.ru.",,,,,,,,,,,,,,
купить,0,детская,0,фотокнига_фотокниги,на выпускной,0,на заказ,0,для фотографий с выпускного вечера,0,оформление,0,0,Z/Москва/спб/Екатеринбург/Новосибирск,"обложки, шаблоны, фоны для выпускных"
сделать,0,выпускная,0,фотокнига_фотокниги,в детский сад,0,в интернете,0,своими руками,0,идеи для детского сада,0,0,Z/Москва/спб/Екатеринбург/Новосибирск,"страницы, шаблоны для детского сада"
скачать,0,школьная,0,фотокнига_фотокниги,класса,0,в интернет магазине,0,для фото,0,создание для старшеклассников,0,0,Z/Москва/спб/Екатеринбург/Новосибирск,"надписи к фото класса, стихи, школьные цитаты"
заказать,0,скрапбукинг,0,фотокнига_фотокниги,для начинающих,0,онлайн,0,дешево,0,изготовление,0,0,Z/Москва/спб/Екатеринбург/Новосибирск/Санкт-Петербург/Воронеж/Краснодар/Нижний Новгород/Самара/Тюмень/Уфа/Ярославль/,"программа, онлайн-редактор"
создать,0,Z,0,фотокнига_фотокниги,лета,0,ручной работы,0,для фото,0,создание для печати бесплатно,0,0,Z/Москва/спб/Екатеринбург/Новосибирск/Санкт-Петербург/Воронеж/Краснодар/Нижний Новгород/Самара/Тюмень/Уфа/Ярославль/,"размеры, шаблоны, темы лета для фотографий"
купить в магазине,0,магнитная,0,фотокнига_фотокниги,года,0,через интернет,0,10х15,0,высокое качество,0,0,Z/Москва/спб/Екатеринбург/Новосибирск/Санкт-Петербург/Воронеж/Краснодар/Нижний Новгород/Самара/Тюмень/Уфа/Ярославль/,"разные шаблоны, примеры оформления, магнитные страницы"
оформить,0,новорожденная,0,фотокнига_фотокниги,первого года,0,на сайте,0,как книга,0,мастер-классы для первого года,0,0,Z/Москва/спб/Екатеринбург/Новосибирск/Санкт-Петербург/Воронеж/Краснодар/Нижний Новгород/Самара/Тюмень/Уфа/Ярославль/,"фона, надписи, стихи для новорожденного"
сделать,0,красивая,0,фотокнига_фотокниги,на выпускной в детский сад,0,своими руками пошагово,0,на 200 фото,0,оформление своими руками в детский сад,0,0,Z/Москва/спб/Екатеринбург/Новосибирск/Санкт-Петербург/Воронеж/Краснодар/Нижний Новгород/Самара/Тюмень/Уфа/Ярославль/,"качественная бумага, твердый переплет в виде выпускной книги книги"
сделать своими руками,0,дорогая,0,фотокнига_фотокниги,выпускника,0,в домашних условиях,0,на 500 фотографий,0,идеи оформления для дома,0,0,Z/Москва/спб/Екатеринбург/Новосибирск/Санкт-Петербург/Воронеж/Краснодар/Нижний Новгород/Самара/Тюмень/Уфа/Ярославль/,"названия, подписи, стихи для выпускника"
оформить,0,первая,0,фотокнига_фотокниги,для новорожденного,0,на заказ,0,недорого для фото с первого дня жизни,0,идеи оформления для новорожденного,0,0,Z/Москва/спб/Екатеринбург/Новосибирск/Санкт-Петербург/Воронеж/Краснодар/Нижний Новгород/Самара/Тюмень/Уфа/Ярославль/,"подписи, тексты, заголовки на рождение"
смотреть,0,частная,0,фотокнига_фотокниги,Z,0,на компьютере,0,самому,0,примеры оформления,0,0,Z/Москва/спб/Екатеринбург/Новосибирск/Санкт-Петербург/Воронеж/Краснодар/Нижний Новгород/Самара/Тюмень/Уфа/Ярославль/,"тексты, стихи, заголовки"
напечатать,0,семейная,0,фотокнига_фотокниги,на юбилей,0,своими руками,0,самому,0,"поздравления на юбилей, цены",0,0,Z/Москва/спб/Екатеринбург/Новосибирск/Санкт-Петербург/Воронеж/Краснодар/Нижний Новгород/Самара/Тюмень/Уфа/Ярославль/,"дизайн, фоны, рамки, стикеры для юбилея"
распечатать,0,школьная,0,фотокнига_фотокниги,ребенка,0,на заказ,0,формата 30х30 для фото,0,темы оформления для школьников,0,0,Z/Москва/спб/Екатеринбург/Новосибирск/Санкт-Петербург/Воронеж/Краснодар/Нижний Новгород/Самара/Тюмень/Уфа/Ярославль/,"примеры, образцы работ на заказ для ребенка"
загрузить,0,большая,0,фотокнига_фотокниги,для школы,0,своими руками пошагово для начинающих,0,для фото,0,стиль и идеи оформления для школы,0,0,Z/Москва/спб/Екатеринбург/Новосибирск/Санкт-Петербург/Воронеж/Краснодар/Нижний Новгород/Самара/Тюмень/Уфа/Ярославль/,"большие форматы, шаблоны и надписи"
посмотреть,0,белая,0,фотокнига_фотокниги,для девушки,0,в подарок,0,на 500 фото,0,изготовление на заказ для девушки,0,0,Z/Москва/спб/Екатеринбург/Новосибирск/Санкт-Петербург/Воронеж/Краснодар/Нижний Новгород/Самара/Тюмень/Уфа/Ярославль/,"образцы, примеры работ, большая галерея"
изготовить,0,школьная,0,фотокнига_фотокниги,4 класс,0,на память,0,для фотографий 10х15,0,"проекты, примеры дизайна для 4 класса",0,0,Z/Москва/спб/Екатеринбург/Новосибирск/Санкт-Петербург/Воронеж/Краснодар/Нижний Новгород/Самара/Тюмень/Уфа/Ярославль/,"поздравления, подписи на память для школьников"
сделать на заказ,0,свадебная,0,фотокнига_фотокниги,на свадьбу,0,в магазине,0,с подписями,0,"темы для свадьбы, изготовление молодоженам",0,0,Z/Москва/спб/Екатеринбург/Новосибирск/Санкт-Петербург/Воронеж/Краснодар/Нижний Новгород/Самара/Тюмень/Уфа/Ярославль/,мягкая и твердая обложки для фотографий из студии
создать онлайн,0,новогодняя,0,фотокнига_фотокниги,для девочки,0,2021,0,на 600 фото,0,"мастер-класс своими руками, темы на Новый год для девочки",0,0,Z/Москва/спб/Екатеринбург/Новосибирск/Санкт-Петербург/Воронеж/Краснодар/Нижний Новгород/Самара/Тюмень/Уфа/Ярославль/,"мягкая и твердая обложки, уроки оформления"
посмотреть,0,хорошая,0,фотокнига_фотокниги,9 класс,0,в виде книги инстаграмм,0,на 300 фото,0,виды оформления страниц для 9 класса,0,0,Z/Москва/спб/Екатеринбург/Новосибирск/Санкт-Петербург/Воронеж/Краснодар/Нижний Новгород/Самара/Тюмень/Уфа/Ярославль/,"редактор для создания, виды переплетов"
создать и напечатать,0,бумажная,0,фотокнига_фотокниги,первого года,0,А4,0,в книжном переплете,0,мастер-класс для начинающих первого года,0,0,Z/Москва/спб/Екатеринбург/Новосибирск/Санкт-Петербург/Воронеж/Краснодар/Нижний Новгород/Самара/Тюмень/Уфа/Ярославль/,"стихи, надписи, коллажи для формата А4"
купить,0,индивидуальная,0,фотокнига_фотокниги,11 класс,0,на кольцах,0,с текстом,0,оформление внутри страниц для 11 класса,0,0,Z/Москва/спб/Екатеринбург/Новосибирск/Санкт-Петербург/Воронеж/Краснодар/Нижний Новгород/Самара/Тюмень/Уфа/Ярославль/,"конструктор, онлайн редактор для фотосессий"
сделать пошагово для начинающих,0,детская,0,фотокнига_фотокниги,малыша баю-бай,0,онлайн бесплатно,0,в коробке foto-book,0,темы оформление листов онлайн,0,0,Z/Москва/спб/Екатеринбург/Новосибирск/Санкт-Петербург/Воронеж/Краснодар/Нижний Новгород/Самара/Тюмень/Уфа/Ярославль/,"заголовоки, стихи, подписи к фотографиям малыша"
купить недорого в интернете,0,подарочная,0,фотокнига_фотокниги,для женщины,0,жизни,0,для снимков,0,"красивое оформление внутри, темы для женщин",0,0,Z/Москва/спб/Екатеринбург/Новосибирск/Санкт-Петербург/Воронеж/Краснодар/Нижний Новгород/Самара/Тюмень/Уфа/Ярославль/,"слова, фразы, надписи для жизненных снимков"
купить,0,школьная,0,фотокнига_фотокниги,выпускника детского сада,0,своими руками пошагово,0,как презентация,0,изготовление для выпускников в виде презентации,0,0,Z/Москва/спб/Екатеринбург/Новосибирск/Санкт-Петербург/Воронеж/Краснодар/Нижний Новгород/Самара/Тюмень/Уфа/Ярославль/,"промокоды, акции, купоны на скидки для детского садика"
оформить,0,военная,0,фотокнига_фотокниги,1941 - 1945,0,жизни,0,описание,0,оформление темы военной жизни 1941-1945,0,0,Z/Москва/спб/Екатеринбург/Новосибирск/Санкт-Петербург/Воронеж/Краснодар/Нижний Новгород/Самара/Тюмень/Уфа/Ярославль/,"онлайн редактор, программа верстки"
оформить,0,личная,0,фотокнига_фотокниги,для мальчика,0,для начинающих,0,с записями,0,оформление обложки для мальчика,0,0,Z/Москва/спб/Екатеринбург/Новосибирск/Санкт-Петербург/Воронеж/Краснодар/Нижний Новгород/Самара/Тюмень/Уфа/Ярославль/,"фоторедактор, программа редактирования"
создать,0,именная,0,фотокнига_фотокниги,семьи,0,в виде небольшой книги,0,на 10 фото,0,"оформление надписями, именные отзывы для семьи",0,0,Z/Москва/спб/Екатеринбург/Новосибирск/Санкт-Петербург/Воронеж/Краснодар/Нижний Новгород/Самара/Тюмень/Уфа/Ярославль/,программа для создания
сделать,0,маленькая,0,фотокнига_фотокниги,на рождение,0,своими руками,0,в виде книги,0,варианты оформления с телефона на рождение,0,0,Z/Москва/спб/Екатеринбург/Новосибирск/Санкт-Петербург/Воронеж/Краснодар/Нижний Новгород/Самара/Тюмень/Уфа/Ярославль/,мир фотографий в виде книги
сделать пошагово для начинающих,0,первая для новорожденного,0,фотокнига_фотокниги,скрапбукинг своими руками,0,с фото от фотографа,0,20 листов,0,мастер-класс по изготовлению листов,0,0,Z/Москва/спб/Екатеринбург/Новосибирск/Санкт-Петербург/Воронеж/Краснодар/Нижний Новгород/Самара/Тюмень/Уфа/Ярославль/,"форматы, шаблоны для фотоблоков"
изготовить,0,памятная,0,фотокнига_фотокниги,на выпускной 11 класс,0,в наборе,0,в виде книги 20х30,0,"описание, красивое оформление на выпускной 11 класса",0,0,Z/Москва/спб/Екатеринбург/Новосибирск/Санкт-Петербург/Воронеж/Краснодар/Нижний Новгород/Самара/Тюмень/Уфа/Ярославль/,форматы фотографий в наборе
сделать,0,школьная,0,фотокнига_фотокниги,на выпускной 9 класс,0,в виде серии,0,на 300 фотографий,0,поздравления на выпускной 9 класса,0,0,Z/Москва/спб/Екатеринбург/Новосибирск/Санкт-Петербург/Воронеж/Краснодар/Нижний Новгород/Самара/Тюмень/Уфа/Ярославль/,"размеры фотографий, разные форматы как серия для школы"
оформить,0,армейская,0,фотокнига_фотокниги,на тему армия,0,на дембель,0,на 200 фотографий,0,оформление для армии бесплатно,0,0,Z/Москва/спб/Екатеринбург/Новосибирск/Санкт-Петербург/Воронеж/Краснодар/Нижний Новгород/Самара/Тюмень/Уфа/Ярославль/,"размеры фото, шаблоны для скачивания для фотошопа"
оформить,0,мини,0,фотокнига_фотокниги,image art,0,с телефона и Instagram,0,на 1000 фотографий,0,"загрузка фото с телефона и с инстаграмм, оформление image art",0,0,Z/Москва/спб/Екатеринбург/Новосибирск/Санкт-Петербург/Воронеж/Краснодар/Нижний Новгород/Самара/Тюмень/Уфа/Ярославль/,"нестандартные размеры, мини форматы"
купить,0,оригинальная,0,фотокнига_фотокниги,на день рождения,0,на официальном сайте,0,на 10 фотографий,0,дизайн для дня рождения на официальном сайте,0,0,Z/Москва/спб/Екатеринбург/Новосибирск/Санкт-Петербург/Воронеж/Краснодар/Нижний Новгород/Самара/Тюмень/Уфа/Ярославль/,"виды, форматы, переплеты, купоны на скидку"
купить,0,классическая,0,фотокнига_фотокниги,первого года жизни,0,заказ в виде книги,0,на 600 фотографий,0,темы оформления для малыша первого года жизни,0,0,Z/Москва/спб/Екатеринбург/Новосибирск/Санкт-Петербург/Воронеж/Краснодар/Нижний Новгород/Самара/Тюмень/Уфа/Ярославль/,твердый переплет для первой книги ребенка с фото
скачать бесплатно,0,цифровая,0,фотокнига_фотокниги,онлайн в интернете,0,ru,0,на 400 фото из социальных сетей,0,"изготовление на заказ, цифровой формат",0,0,Z/Москва/спб/Екатеринбург/Новосибирск/Санкт-Петербург/Воронеж/Краснодар/Нижний Новгород/Самара/Тюмень/Уфа/Ярославль/,бесплатные программы на русском языке
заказать,0,именная на заказ,0,фотокнига_фотокниги,для любимой,0,с темой любовь,0,на 100 фото,0,скачивание фотографий из соц.сетей,0,0,Z/Москва/спб/Екатеринбург/Новосибирск/Санкт-Петербург/Воронеж/Краснодар/Нижний Новгород/Самара/Тюмень/Уфа/Ярославль/,"переплеты, размеры, обложки для любимой"
сделать,0,памятная на заказ,0,фотокнига_фотокниги,для мужчины,0,самостоятельно на компьютере,0,на 36 фото,0,красивое арт оформление для мужчины,0,0,Z/Москва/спб/Екатеринбург/Новосибирск,"развороты, коллажи из фотографий и заставок"
