title,"${setText(w3, 'Фотокнига')} ${setText(w4, 'на выпускной')} ${setText(w6, 'на заказ')} ${setText(w1, 'купить')} на U4U.ru. ${setText(w2, 'Детская')} ${setText(w3, 'фотокнига')} ${setText(w6, 'для фото')} ${setText(w9s, 'в Москве')}. ${setText(w7, 'Оформление')}. ${setText(w10, 'Обложки')}. Цены. Печать на своем производстве.",,,,,,,,,,,,,,
сделать,0,домашняя,0,фотокнига_фотокниги,бабушке,0,в винтажном стиле,0,для черно-белых фотографий,0,ретро оформление старых фото для бабушки,0,0,Z/Москва/спб/Екатеринбург/Новосибирск,выбор обложек и ретро дизайна
сделать,0,памятная,0,фотокнига_фотокниги,дедушке,0,на память о семье,0,с местом для записей,0,оформление страниц для дедушки,0,0,Z/Москва/спб,различные переплеты для старинных фото семьи
сделать,0,стандартная,0,фотокнига_фотокниги,для начинающих,0,своими руками пошагово,0,для фото различных форматов,0,стандартные шаблоны и дизайн страниц самим,0,0,Z/Москва/спб/Екатеринбург/Новосибирск,простой редактор фотографий для начинающих
оформить онлайн,0,первая,0,фотокнига_фотокниги,первоклассника,0,на память о школе,0,с веселыми подписями,0,красивые темы оформления для первоклассника,0,0,Z/Москва/спб/Екатеринбург/Новосибирск,первые школьные обложки
сделать,0,семейная,0,фотокнига_фотокниги,родителям,0,на память в подарок,0,с надписями к фото,0,семейные темы оформления,0,0,Z/Москва/спб/Екатеринбург/Новосибирск,классический дизайн
заказать,0,свадебная,0,фотокнига_фотокниги,молодоженов,0,онлайн в интернете,0,на 200 фото 10х15,0,свадебное оформление для молодоженов на 200 фотографий,0,0,Z/Москва/спб/Екатеринбург/Новосибирск,"красивые обложки, дизайнерские онлайн страницы"
создать,0,эксклюзивная,0,фотокнига_фотокниги,для фотографов,0,на сайте на заказ,0,для фотографий,0,варианты оформления для фото на заказ,0,0,Z/Москва/спб/Екатеринбург/Новосибирск,"удобный редактор для фотографов, готовые шаблоны"
заказать,0,печатная,0,фотокнига_фотокниги,мужу,0,в интернет магазине,0,с подписями к фотографиям,0,дизайн для мужа,0,0,Z/Москва/спб/Екатеринбург/Новосибирск,красивые печатные обложки и страницы внутри
посмотреть,0,детская,0,фотокнига_фотокниги,baby,0,в интернете,0,как дневник малыша,0,примеры оформления baby дневника ребенка,0,0,Z/Москва/спб/Екатеринбург/Новосибирск,"фоны, обложки, страницы для малышей"
оформить,0,военная,0,фотокнига_фотокниги,ко Дню Победы,0,на сайте,0,с темой войны,0,примеры оформления темы войны ко Дню Победы,0,0,Z/Москва/спб/Екатеринбург/Новосибирск,лаконичный военный дизайн
купить,0,большая семейная,0,фотокнига_фотокниги,на годовщину свадьбы,0,в подарок,0,для больших фото,0,примеры оформления на годовщину свадьбы,0,0,Z/Москва/спб/Екатеринбург/Новосибирск,"стильные обложки, страницы, подписи"
оформить,0,индивидуальная,0,фотокнига_фотокниги,выпускника детского сада,0,онлайн на сайте,0,на 30 фото,0,варианты оформления для выпускников детского сада,0,0,Z/Москва/спб/Екатеринбург/Новосибирск,"простой онлайн редактор, страницы и обложки для детей"
купить,0,винтажная,0,фотокнига_фотокниги,сестре,0,онлайн в интернете,0,на 40 фото,0,разные стили ретро оформления любимой сестре,0,0,Z/Москва/спб/Екатеринбург/Новосибирск,дизайн для фотографий
сделать,0,яркая,0,фотокнига_фотокниги,в виде книги,0,своими руками на заказ,0,для фотографий,0,оформление фото для книги на заказ,0,0,Z/Москва/спб/Екатеринбург/Новосибирск,"красивые фоны, обложки, удобный редактор"
создать,0,виртуальная,0,фотокнига_фотокниги,детство,0,онлайн,0,с электронным перелыстыванием страниц,0,оформление в стиле детство,0,0,Z/Москва/спб/Екатеринбург/Новосибирск,простой редактор для работы в интернете
заказать,0,школьная,0,фотокнига_фотокниги,1 сентября,0,на официальном сайте онлайн,0,для празничных фото,0,изготовление на заказ в типографии на 1 сентября,0,0,Z/Москва/спб,бесплатное праздничное оформление
оформить,0,комбинированная,0,фотокнига_фотокниги,для новорожденного первый год жизни,0,самому,0,на стандартный размер фото 15х21 и 10х15,0,примеры для новорожденного первого года жизни,0,0,Z/Москва/спб,дизайн для малышей
купить,0,веселая,0,фотокнига_фотокниги,на первый год малыша,0,на заказ,0,для детских фото из жизни первого года малыша,0,профессиональное изготовление на заказ,0,0,Z/Москва/спб,первый дизайн для ребенка
создать,0,памятная,0,фотокнига_фотокниги,коллеге,0,на память на заказ,0,в виде открытки,0,"идеи оформления для коллеги, изготовление на заказ",0,0,Z/Москва/спб,красивая упаковка на память
купить,0,креативная,0,фотокнига_фотокниги,для влюбленных,0,любимому в подарок,0,с фотографиями,0,оформление совместных фотографий любимому,0,0,Z/Москва/спб,"темы для влюбленных, названия, подписи, стихи к фото"
создать,0,классная,0,фотокнига_фотокниги,руководителю,0,онлайн в подарок,0,в виде книги,0,оформление онлайн как книга,0,0,Z/Москва/спб,"подписи, стихи, цитаты руководителю"
сделать,0,тематическая,0,фотокнига_фотокниги,животных,0,на память,0,любимых питомцев,0,варианты оформления для животных,0,0,Z/Москва/спб,"библиотека фонов, стикеров, обложек для ваших питомцев"
сделать,0,крутая,0,фотокнига_фотокниги,для парня,0,своими руками на день рождения,0,для крутых фото,0,идеи оформления для парня на день рождения,0,0,Z/Москва/спб,простой онлайн редактор для фотографий
купить,0,Z,0,фотокнига_фотокниги,первая для девочки,0,на заказ в интернете,0,для фото первого года жизни,0,оформление для девочки в нежных тонах,0,0,Z/Москва/спб,"разные переплеты, красивый дизайн, подарочные сертификаты"
заказать онлайн,0,шуточная,0,фотокнига_фотокниги,детский мир,0,в интернет-магазине,0,без кармашков,0,детское оформление онлайн,0,0,Z/Москва/спб,страницы с подписями к фотографиям
заказать,0,большая детская,0,фотокнига_фотокниги,на крестины,0,в интернете,0,для больших и маленьких фотографий,0,темы оформления крестин,0,0,Z/Москва/спб,"шаблоны, страницы со стихами для детей"
оформить онлайн,0,детская,0,фотокнига_фотокниги,от 0 до года,0,на сайте,0,для фото,0,темы оформления страниц для малышей от 0 до года,0,0,Z/Москва/спб,"милый дизайн, обложеки и фоны для самых маленьких"
купить,0,новорожденная,0,фотокнига_фотокниги,"привет, я родился",0,в интернет-магазине ручной работы,0,для фотографий первого года жизни,0,"дизайн для новорожденных - привет, я родился!",0,0,Z/Москва/спб,"темы, фоны, стикеры для ручного оформления"
сделать,0,самодельная,0,фотокнига_фотокниги,на рождение ребенка,0,своими руками пошагово,0,с фото,0,мастер-классы по оформлению самому на компьютере,0,0,Z/Москва/спб,электронная программа для ваших фотографий
создать,0,декоративная,0,фотокнига_фотокниги,на рождение,0,как подарок на день рождения,0,моя семья,0,примеры оформления в виде открытки для семьи,0,0,Z/Москва/спб/ Екатеринбург/ Новосибирск,надписи и поздравления для дня рождения
заказать,0,белая,0,фотокнига_фотокниги,беременности,0,на память,0,для характерных фото,0,оформление на память о беременности,0,0,Z/Москва/спб,"страницы, фоны, блоки фотографий"
создать,0,самая лучшая,0,фотокнига_фотокниги,для семейной пары,0,в подарок на юбилей свадьбы,0,на 200 фото,0,темы оформления на юбилей,0,0,Z/Москва/спб,"конкурсы, бонусы, скидки для семейных пар"
заказать,0,глянцевая,0,фотокнига_фотокниги,для средней школы,0,в подарок ученикам школы,0,для фото,0,варианты оформления для средней школы,0,0,Z/Москва/спб,производство и печать в типографии
оформить,0,винтажная,0,фотокнига_фотокниги,под старину,0,на компьютере самостоятельно,0,для старинных фотографий,0,темы оформление под старину,0,0,Z/Москва/спб,программа для самостоятельной верстки фото
заказать,0,стильная,0,фотокнига_фотокниги,для организации,0,онлайн,0,для фотографий,0,печать в типографии,0,0,Z/Москва/спб,бесплатные шаблоны онлайн для организации
заполнить,0,праздничная,0,фотокнига_фотокниги,мой любимый детский сад,0,самостоятельно,0,темы сказок,0,самостоятельное изготовление для детского сада,0,0,Z/Москва/спб,"сказочные фоны, темы и страницы"
сделать,0,белая,0,фотокнига_фотокниги,невесты,0,своими руками на память о свадьбе,0,для черно-белых фотографий,0,белый стиль оформления для невесты,0,0,Z/Москва/спб,эскизы для страниц и разворотов
оформить,0,красивая дорогая,0,фотокнига_фотокниги,на золотую свадьбу,0,онлайн своими руками в подарок родителям,0,с фотографиями на юбилей свадьбы,0,"оформление премиум класса, подписи, поздравления и стихи",0,0,Z/Москва/спб,подарочные сертификаты на золотую свадьбу
заказать,0,однотонная,0,фотокнига_фотокниги,для бизнеса,0,на заказ онлайн,0,недорого,0,"примеры оформления, галерея идей",0,0,Z/Москва/спб,"фоны, готовые макеты для бизнеса"
сделать,0,памятная,0,фотокнига_фотокниги,отпуска,0,на память о путешествии,0,для фотографий,0,темы для оформления фото из отпуска,0,0,Z/Москва/спб,"типы, форматы, переплеты"
создать,0,родословная,0,фотокнига_фотокниги,для внучки,0,на память о семье,0,в виде книги,0,идеи дизайна в виде книги внучке,0,0,Z/Москва/спб,пошаговые инструкции оформления
создать,0,качественная,0,фотокнига_фотокниги,на год отношений,0,в подарок,0,с фото и комментариями,0,качественный дизайн для фотографий на год отношений,0,0,Z/Москва/спб,"векторы, шаблоны, стикеры для влюбленных"
сделать,0,детская,0,фотокнига_фотокниги,принцессы,0,своими руками,0,с фотографиями малышки,0,сказочное оформление фото принцессы,0,0,Z/Москва/спб/Екатеринбург/Новосибирск,обложки с фотографиями малышки
оформить,0,школьная,0,фотокнига_фотокниги,для гимназии,0,онлайн на сайте,0,с фотографиями учеников,0,идеи дизайна для учеников гимназии,0,0,Z/Москва/спб,"инструкции по оформлению, готовые шаблоны"
оформить,0,зимняя,0,фотокнига_фотокниги,отдыха,0,онлайн на компьютере самостоятельно,0,с фото семьи,0,темы для оформления фотографий семьи с зимнего отдыха,0,0,Z/Москва/спб,онлайн редактор для работы самому
сделать,0,спортивная,0,фотокнига_фотокниги,для подростка,0,на заказ онлайн,0,с фото на тему спорт,0,спортивные темы для фотографий подростка,0,0,Z/Москва/спб,"акции, распродажи, подарочные сертификаты"
заказать,0,дорожная,0,фотокнига_фотокниги,путешественника,0,онлайн,0,с фото путешествия,0,темы дизайна для путешественника,0,0,Z/Москва/спб,"удобный онлайн редактор для фотографий, готовые шаблоны"
купить,0,милая,0,фотокнига_фотокниги,первый год жизни малыша,0,на заказ онлайн,0,для первых фотографий,0,дизайн для оформления фото первого года жизни,0,0,Z/Москва/спб,"картинки, стикеры, обложки для детей"
скачать,0,вертикальная,0,фотокнига_фотокниги,от года до 7 лет,0,на сайте в интернете,0,для разных фото,0,проекты оформления фотографий от года и до 7 лет,0,0,Z/Москва/спб,примеры фотосессий детей
заказать,0,дизайнерская,0,фотокнига_фотокниги,история нашей любви,0,как подарок любимому своими руками,0,для совместных фото,0,варианты дизайна для оформления самостоятельно,0,0,Z/Москва/спб,картинки для оформления совместных фотографий
заказать,0,небольшая,0,фотокнига_фотокниги,на годик,0,своими руками,0,небольшого формата 20х20,0,темы оформления небольших проектов для детей,0,0,Z/Москва/спб,"шаблоны для форматов 20х20, 30х20, 30х30"
сделать,0,скетчбук,0,фотокнига_фотокниги,для подруги на день рождения,0,в подарок своими руками,0,с фотографиями,0,готовые темы оформления фото на день рождения,0,0,Z/Москва/спб,"фоторамки, украшения, декор для подруги"
создать,0,памятная,0,фотокнига_фотокниги,воспитателю,0,в подарок на память от родителей и детей,0,с фото,0,профессиональная печать фотографий для подарка,0,0,Z/Москва/спб,"красивые фразы для воспитателей, родителей и детей"
заказать,0,мужская,0,фотокнига_фотокниги,для папы,0,онлайн в подарок,0,с подписями для фотографий,0,образцы дизайна для фото папы,0,0,Z/Москва/спб,оформление портретов с надписями и поздравлениями
купить,0,школьная,0,фотокнига_фотокниги,первый раз в первый класс,0,в интернете на заказ,0,для фотографий класса,0,примеры оформления для 1 класса,0,0,Z/Москва/спб,проекты для школы с готовыми подписями первоклашкам
сделать,0,подарочная,0,фотокнига_фотокниги,"до свидания, детский сад",0,своими руками,0,для фотографий детей,0,темы дизайна в детский садик,0,0,Z/Москва/спб,"подписи, стихи, для фото, подарочные коробки"
заказать,0,традиционная,0,фотокнига_фотокниги,для дочери,0,в интернете онлайн,0,для фото,0,изготовление на заказ для дочери,0,0,Z/Москва/спб,онлайн темы для оформления фотографий
оформить онлайн,0,Z,0,фотокнига_фотокниги,для сына,0,онлайн в интернете,0,в подарок с фотографиями,0,идеи оформления подарка для сына,0,0,Z/Москва/спб/Екатеринбург/Новосибирск,"пожелания, стихи , цитаты"
заказать,0,полиграфическая,0,фотокнига_фотокниги,для школы,0,бесплатно для распечатки,0,для осенних фото,0,полиграфическая печать,0,0,Z/Москва/спб/Екатеринбург/Новосибирск,школьные фотопроекты на тему осень
заказать,0,корпоративная,0,фотокнига_фотокниги,для работы,0,онлайн на заказ,0,для фото сотрудников,0,корпоративный стиль оформления,0,0,Z/Москва/спб/Екатеринбург/Новосибирск,"сборка коллажей, услуги дизайнера"
сделать,0,семейная,0,фотокнига_фотокниги,для мамы,0,онлайн,0,с местом для записей,0,варианты оформления для мамы,0,0,Z/Москва/спб/Екатеринбург/Новосибирск,"обложки с фотографиями, стикеры, подписи"