title,"${setText(w3, 'Фотокнига')} ${setText(w4, 'на выпускной')} ${setText(w6, 'на заказ')} ${setText(w1, 'купить')} на U4U.ru. ${setText(w2, 'Детская')} ${setText(w3, 'фотокнига')} ${setText(w6, 'для фото')} ${setText(w9s, 'в Москве')}. ${setText(w7, 'Оформление')}. ${setText(w10, 'Обложки')}. Цены. Печать на своем производстве.",,,,,,,,,,,,,,
создать,0,прикольная,0,фотокнига_фотокниги,индивидуальная выпускников детского сада,0,пошагово,0,на 400 фотографий,0,"печать разноформатных фотографий, индивидуальные темы",0,0,Z/Москва/спб/Екатеринбург/Новосибирск,каталог примеров работ для выпускников детского сада
заказать,0,женская,0,фотокнига_фотокниги,для подруги,0,на официальном сайте,0,20 фото,0,"печать в типографии, оформление для подруги",0,0,Z/Москва/спб/Екатеринбург/Новосибирск,стандартные размеры для фото из соц.сетей
создать онлайн,0,морская,0,фотокнига_фотокниги,путешествия,0,бесплатно самим,0,с фотографиями отпуска,0,оформление с темой море,0,0,Z/Москва/спб/Екатеринбург/Новосибирск,"программа для верстки бесплатно, купоны на скидку"
купить недорого,0,стильная,0,фотокнига_фотокниги,для новорожденного первый год,0,с записями,0,на 100 фотографий,0,образцы оформления для печати,0,0,Z/Москва/спб/Екатеринбург/Новосибирск,блоки для фотографий первого года новорожденного
купить,0,красивая,0,фотокнига_фотокниги,цветов,0,в подарок,0,на 20 фотографий,0,дизайн и цветочное оформление в подарок,0,0,Z/Москва/спб/Екатеринбург/Новосибирск,"темы природы, цветов, времен года"
сделать,0,осенняя,0,фотокнига_фотокниги,скрапбукинг пошагово,0,своими руками с фото,0,на 50 фотографий,0,дизайн на тему осень,0,0,Z/Москва/спб/Екатеринбург/Новосибирск,заготовки для сборки в фотошопе самому
скачать,0,электронная,0,фотокнига_фотокниги,для начальной школы,0,бесплатно,0,для фотошопа,0,просмотр вариантов,0,0,Z/Москва/спб/Екатеринбург/Новосибирск,"проекты работ для начальной школы, отзывы"
заказать,0,юбилейная,0,фотокнига_фотокниги,родителям,0,недорого в интернете,0,быстро,0,варианты недорогой полиграфической печати,0,0,Z/Москва/спб/Екатеринбург/Новосибирск,тексты на русском языке для родителей
купить недорого,0,семейная,0,фотокнига_фотокниги,для старых фотографий,0,на заказ,0,хорошего качества,0,печать в типографии старых позитив фотографий,0,0,Z/Москва/спб/Екатеринбург/Новосибирск,"удобный онлайн сервис, реальные отзывы"
купить,0,готовая,0,фотокнига_фотокниги,для больших фотографий,0,в интернет-магазине,0,Z,0,примеры оформления больших фотографий на сайте,0,0,Z/Москва/спб/Екатеринбург/Новосибирск,"подписи к фото, программа для верстки"
купить,0,первая,0,фотокнига_фотокниги,на 1 год,0,один из серии,0,срочно,0,"услуги полиграфии, срочное изготовление",0,0,Z/Москва/спб/Екатеринбург/Новосибирск,"стихи, надписи на 1 год, размеры для серии"
смотреть,0,смешная,0,фотокнига_фотокниги,детские годы,0,видео,0,30х30,0,"детские поздравления, видео примеры",0,0,Z/Москва/спб/Екатеринбург/Новосибирск,шаблоны страниц на тему детские годы
оформить,0,выпускная,0,фотокнига_фотокниги,школьные годы,0,в электронном виде,0,с разными форматами фотографий,0,оформление страниц школьные годы электронно,0,0,Z/Москва/спб/Екатеринбург/Новосибирск,"создание для печати бесплатно, рейтинги тем"
найти,0,школьная,0,фотокнига_фотокниги,выпускника школы,0,на заказ в интернете,0,для фото,0,"полиграфическая печать, оформление бесплатно",0,0,Z/Москва/спб/Екатеринбург/Новосибирск,галерея работ для выпускников школы
создать,0,бумажная,0,фотокнига_фотокниги,для выпускника 4 класса,0,на выпуск,0,с бумажными страницами,0,создание в группе для выпускников 4 класса,0,0,Z/Москва/спб/Екатеринбург/Новосибирск,"картинки, стикеры, фоны для начальной школы"
сделать самому,0,выпускная,0,фотокнига_фотокниги,для выпускника 9 класса,0,из фотографий на заказ,0,дешево,0,"стоимость печати, бесплатный дизайн",0,0,Z/Москва/спб/Екатеринбург/Новосибирск,рамки для фото для выпускников 9 класса
собрать,0,выпускная,0,фотокнига_фотокниги,для выпускника 11 класса,0,создание онлайн,0,для разных фото,0,оформление онлайн выпускников 11 класса,0,0,Z/Москва/спб/Екатеринбург/Новосибирск,"бесплатная программа для создания, купоны на скидки"
составить,0,семейная,0,фотокнига_фотокниги,для семейных фото,0,бесплатно,0,своими руками,0,мастер-класс по оформлению семейных фотографий,0,0,Z/Москва/спб/Екатеринбург/Новосибирск,"цитаты, реальные отзывы заказчиков"
заказать,0,домашняя,0,фотокнига_фотокниги,крещение,0,в интернете,0,с кармашками для записок,0,оформление страниц с темой крещение,0,0,Z/Москва/спб/Екатеринбург/Новосибирск,стоимость изготовления
сделать,0,домашняя,0,фотокнига_фотокниги,для старых фото,0,самостоятельно,0,в стиле винтаж,0,идеи оформления старых фотографий,0,0,Z/Москва/спб/Екатеринбург/Новосибирск,"форзацы, рамки, стикеры в ретро-стиле"
сделать,0,розовая,0,фотокнига_фотокниги,для новорожденной девочки,0,самому,0,с картонными страницами,0,темы формления для новорожденной девочки,0,0,Z/Москва/спб/Екатеринбург/Новосибирск,розовые страницы и обложки для малышки
создать и напечатать,0,детская,0,фотокнига_фотокниги,для новорожденного мальчика,0,на сайте,0,на 500 фотографий 10х15,0,темы дизайна для новорожденного мальчика,0,0,Z/Москва/спб/Екатеринбург/Новосибирск,"подложки под фото, рамочки, стикеры для малыша"
заказать,0,школьная,0,фотокнига_фотокниги,школьника,0,в интернет-магазине онлайн,0,на 30 листов,0,оформление на заказ для школьника,0,0,Z/Москва/спб/Екатеринбург/Новосибирск,"переплет на пружине, книжный переплет в твердой и мягкой обложках"
заказать,0,черная,0,фотокнига_фотокниги,на 10 фото,0,недорого онлайн,0,на 50 листов,0,оформление в виде блокнота на 10 фотографий,0,0,Z/Москва/спб,"черные листы, стильные украшения"
оформить,0,книжная,0,фотокнига_фотокниги,на 20 фото,0,бесплатно,0,для фотографий,0,идеи оформления и шаблоны бесплатно,0,0,Z/Москва/спб,"первая страница, индивидуальные обложки"
создать,0,свадебная,0,фотокнига_фотокниги,на 36 фото,0,своими руками пошагово с фото,0,в стиле классика,0,классическое оформление для печати самому,0,0,Z/Москва/спб/Екатеринбург/Новосибирск,"декор, рамки, фоны для фотографий"
заказать,0,классическая,0,фотокнига_фотокниги,для семейных фотографий,0,недорого в интернете,0,в ретро стиле,0,оформление разноформатных семейных фотографий,0,0,Z/Москва/спб/Екатеринбург/Новосибирск,"фоторамки, украшения, фоны в стиле винтаж"
оформить,0,простая,0,фотокнига_фотокниги,скрапбукинг своими руками пошагово,0,бесплатно,0,для начинающих,0,идеи оформления для начинающих,0,0,Z/Москва/спб/Екатеринбург/Новосибирск,"украшения, простой онлайн редактор для верстки"
оформить онлайн,0,школьная,0,фотокнига_фотокниги,ученика,0,с фото своими руками,0,5 фото,0,примеры оформления для ученика школы,0,0,Z/Москва/спб/Екатеринбург/Новосибирск,"программа для верстки, стоимость изготовления"
украсить,0,новорожденная,0,фотокнига_фотокниги,своими руками для мальчика,0,для начинающих,0,для детских фото,0,идеи оформления для новорожденного малыша,0,0,Z/Москва/спб/Екатеринбург/Новосибирск,"стикеры, фоторамки, дизайн для мальчика"
изготовить,0,летняя,0,фотокнига_фотокниги,на выпускной,0,в интернете,0,для наклеивания фотографий,0,цены изготовления на заказ на выпускной,0,0,Z/Москва/спб/Екатеринбург/Новосибирск,"технологии производства, стоимость изготовления"
купить,0,классическая,0,фотокнига_фотокниги,для больших фото,0,на официальном сайте,0,в переплете,0,изготовление больших фотографий в книжном переплете,0,0,Z/Москва/спб/Екатеринбург/Новосибирск,"тематика, подложки под фото, рисунки"
посмотреть,0,тематическая,0,фотокнига_фотокниги,для наклеивания фотографий,0,в интернете,0,с темой СССР,0,высокое качество печати тематических советских страниц,0,0,Z/Москва/спб/Екатеринбург/Новосибирск,крепление фотографий для наклеивания
создать,0,семейная,0,фотокнига_фотокниги,семьи своими руками,0,пошагово,0,для стандартного размера фотографий,0,стандартные форматы для оформления своими руками,0,0,Z/Москва/спб/Екатеринбург/Новосибирск,"программа на русском языке, пошаговые инструкции для семьи"
украсить,0,первая,0,фотокнига_фотокниги,1 класс,0,для школы,0,20х30,0,темы оформление формата 20х30 для 1 класса школы,0,0,Z/Москва/спб/Екатеринбург/Новосибирск,"хранение, упаковка, доставка"
скачать,0,любительская,0,фотокнига_фотокниги,2 класс,0,в интернете,0,с перелыстыванием страниц,0,варианты оформления для 2 класса,0,0,Z/Москва/спб/Екатеринбург/Новосибирск,"схемы шаблонов, темы с красивыми страницами"
купить,0,картонная,0,фотокнига_фотокниги,3 класс,0,онлайн,0,на 10 фотографий,0,изготовление для 3 класса на заказ,0,0,Z/Москва/спб/Екатеринбург/Новосибирск,"детские обложки, фона, стикеры"
создать,0,современная,0,фотокнига_фотокниги,5 класс,0,онлайн,0,на 400 фотографий 10х15,0,"бесплатное оформление, создание для 5 класса",0,0,Z/Москва/спб/Екатеринбург/Новосибирск,"заставки для фото, украшения страниц"
оформить онлайн,0,общая,0,фотокнига_фотокниги,6 класс,0,на сайте,0,на 100 фото 10х15,0,бесплатное оформление для 6 класса,0,0,Z/Москва/спб,"приложение для фотографов, редактор для создания на сайте"
создать,0,новая,0,фотокнига_фотокниги,7 класс,0,наш класс,0,недорого,0,бесплатное оформление для 7 класса,0,0,Z/Москва/спб,"профессиональная верстка, шаблоны для школы"
оформить,0,красная,0,фотокнига_фотокниги,8 класс,0,самостоятельно,0,с записями,0,самостоятельное оформление бесплатно,0,0,Z/Москва/спб,"красные темы дизайна, фоны, стикеры с надписями для 8 класса"
создать в группе,0,совместная,0,фотокнига_фотокниги,10 класс,0,одноклассников,0,с темой осень,0,совместное создание класса для печати,0,0,Z/Москва/спб,варианты осеннего дизайна для одноклассников 10 класса
найти,0,открытая,0,фотокнига_фотокниги,на 2 года малыша,0,недорого в интернете,0,с темой космос,0,космическая тема для фото печати,0,0,Z/Москва/спб,"материалы, бумага, обложки на 2 года малыша"
посмотреть,0,распечатанная,0,фотокнига_фотокниги,3 года,0,в подарок,0,15х15 с фото,0,изготовление в подарок на 3 года,0,0,Z/Москва/спб,просмотр распечатанных образцов
сделать онлайн,0,необычная,0,фотокнига_фотокниги,4 года,0,онлайн,0,на 15 фотографий,0,необычные идеи дизайна для фото,0,0,Z/Москва/спб,большой выбор идей на 4 года
создать онлайн,0,крафтовая,0,фотокнига_фотокниги,5 лет,0,бесплатно для распечатки,0,в стиле крафт,0,идеи создания на 5 лет,0,0,Z/Москва/спб,примеры оформления онлайн бесплатно
напечатать,0,твердая,0,фотокнига_фотокниги,6 лет,0,из фотографий на заказ,0,на 100 фотографий 10х15,0,печать в типографии для фото на заказ,0,0,Z/Москва/спб,высокое качество исполнения для 6 лет
смотреть онлайн,0,поларойдная,0,фотокнига_фотокниги,7 лет,0,в интернете,0,с темой поларойд,0,онлайн оформление для 7 лет,0,0,Z/Москва/спб,"шаблоны, обложки, темы поларойд"
создать онлайн,0,интересная,0,фотокнига_фотокниги,10 лет,0,самому,0,на 200 фотографий 10х15,0,темы дизайна для фотографий 10х15,0,0,Z/Москва/спб,готовые макеты на 10 лет
купить,0,необычная,0,фотокнига_фотокниги,18 лет,0,онлайн в интернете,0,для разных фотографий,0,онлайн оформление на 18 лет,0,0,Z/Москва/спб/Екатеринбург/Новосибирск,примеры дизайна для разных фото
заказать,0,именная,0,фотокнига_фотокниги,20 лет,0,в подарок,0,на 600 страниц,0,изготовление в подарок на 20 лет на заказ,0,0,Z/Москва/спб/Екатеринбург/Новосибирск,"переплеты, форматы, дизайн страниц"
купить недорого,0,черно-белая,0,фотокнига_фотокниги,25 лет,0,в интернете на сайте,0,для фотографий,0,оформление онлайн и изготовление на 25 лет,0,0,Z/Москва/спб/Екатеринбург/Новосибирск,выбор идей черно-белого дизайна
оформить онлайн,0,красивая своими руками,0,фотокнига_фотокниги,30 лет,0,пошагово,0,на 100 страниц,0,красивые темы оформления на 30 лет,0,0,Z/Москва/спб,"программа создания страниц пошагово, технология изготовления"
заказать,0,юбилейная,0,фотокнига_фотокниги,40 лет,0,на официальном сайте,0,для фото,0,юбилейное изготовление на заказ,0,0,Z/Москва/спб,темы оформления и дизайн на 40 лет
купить онлайн,0,дорогая,0,фотокнига_фотокниги,50 лет,0,на заказ в интернете,0,для фотографий,0,стили и изготовление на юбилей 50 лет,0,0,Z/Москва/спб,дизайн для оформления фото
заказать,0,классическая,0,фотокнига_фотокниги,60 лет,0,онлайн,0,в стиле классика,0,онлайн оформление для печати,0,0,Z/Москва/спб/Екатеринбург/Новосибирск,выбор идей на 60 лет
создать,0,архивная,0,фотокнига_фотокниги,70 лет,0,на заказ в интернете,0,на 100 страниц,0,оформление на юбилей 70 лет,0,0,Z/Москва/спб/Екатеринбург/Новосибирск,примеры архивных работ
создать,0,выпускная,0,фотокнига_фотокниги,на последний звонок,0,формата А4,0,с фотографиями,0,примеры оформления на последний звонок,0,0,Z/Москва/спб/Екатеринбург/Новосибирск,стиль для выпускных фото формата А4
заказать,0,женская,0,фотокнига_фотокниги,на юбилей женщине,0,на сайте в интернете,0,с подписями,0,оформление на заказ на юбилей женщине,0,0,Z/Москва/спб,"женские темы, дизайн, украшения"
заказать,0,именная,0,фотокнига_фотокниги,на юбилей мужчине,0,онлайн в интернете,0,для фото в классическом стиле,0,формление для мужчин на заказ,0,0,Z/Москва/спб,выбор стиля и рейтинг тем на юбилей
оформить,0,детская,0,фотокнига_фотокниги,праздника,0,бесплатно,0,своими руками,0,примеры оформления самостоятельно,0,0,Z/Москва/спб,большой выбор идей для детского праздника
издать,0,дорогая,0,фотокнига_фотокниги,премиум,0,на заказ,0,на 300 фотографий 10х15,0,премиум дизайн для профессиональной печати,0,0,Z/Москва/спб,примеры оформления фото 10х15
создать онлайн,0,первая,0,фотокнига_фотокниги,1 год жизни,0,для ребенка на сайте,0,для фото,0,темы оформления на 1 год жизни ребенка,0,0,Z/Москва/спб,редактор для создания дизайна
создать онлайн,0,для выпускников,0,фотокнига_фотокниги,на выпускной 4 класс,0,в интернете онлайн,0,в твердом переплете,0,школьные темы оформления для 4 класса,0,0,Z/Москва/спб/Екатеринбург/Новосибирск,фоны для презентации выпускников начальной школы
сделать,0,приватная,0,фотокнига_фотокниги,любимому,0,своими руками пошагово,0,с подписями фотографий,0,оформление в печать для любимого человека,0,0,Z/Москва/спб/Екатеринбург/Новосибирск,"подписи к фото, фразы, выражения."
купить,0,памятная,0,фотокнига_фотокниги,городов,0,на память на сайте,0,с фотографиями,0,красивые страницы с темами городов,0,0,Z/Москва/спб/Екатеринбург/Новосибирск,запоминающиеся обложки с фото на память
сделать самому,0,подарочная,0,фотокнига_фотокниги,для новорожденного первый год,0,по месяцам,0,с фото,0,оформление для новорожденного первого года,0,0,Z/Москва/спб/Екатеринбург/Новосибирск,программы и шаблоны для фотографий по месяцам
купить,0,мужская,0,фотокнига_фотокниги,для друга,0,в подарок,0,с черными страницами,0,оформление страниц для мужчин,0,0,Z/Москва/спб/Екатеринбург/Новосибирск,"подписи к фотографиям друга, мужской стиль"
